Ether / ARP who has 10.10.10.251 says 10.10.10.49
Ether / ARP is at 00:12:79:80:69:60 says 10.10.10.251 / Padding
Ether / IP / TCP 10.10.10.49:55341 > 10.10.10.251:ipp S
10.10.10.49 -> 10.10.10.251
Ether / IP / TCP 10.10.10.251:ipp > 10.10.10.49:55341 SA
10.10.10.251 -> 10.10.10.49
Ether / IP / TCP 10.10.10.49:55341 > 10.10.10.251:ipp A
10.10.10.49 -> 10.10.10.251
Ether / IP / TCP 10.10.10.49:55341 > 10.10.10.251:ipp PA / Raw
10.10.10.49 -> 10.10.10.251
Ether / IP / TCP 10.10.10.49:55341 > 10.10.10.251:ipp PA / Raw
10.10.10.49 -> 10.10.10.251
Ether / IP / TCP 10.10.10.251:ipp > 10.10.10.49:55341 A
10.10.10.251 -> 10.10.10.49
Ether / IP / TCP 10.10.10.251:ipp > 10.10.10.49:55341 PA / Raw
10.10.10.251 -> 10.10.10.49
Ether / IP / TCP 10.10.10.49:55341 > 10.10.10.251:ipp A
10.10.10.49 -> 10.10.10.251
Ether / IP / TCP 10.10.10.251:ipp > 10.10.10.49:55341 PA / Raw
10.10.10.251 -> 10.10.10.49
Ether / IP / TCP 10.10.10.49:55341 > 10.10.10.251:ipp A
10.10.10.49 -> 10.10.10.251
Ether / IP / TCP 10.10.10.251:ipp > 10.10.10.49:55341 PA / Raw
10.10.10.251 -> 10.10.10.49
Ether / IP / TCP 10.10.10.49:55341 > 10.10.10.251:ipp A
10.10.10.49 -> 10.10.10.251
Ether / IP / TCP 10.10.10.251:ipp > 10.10.10.49:55341 PA / Raw
10.10.10.251 -> 10.10.10.49
Ether / IP / TCP 10.10.10.49:55341 > 10.10.10.251:ipp A
10.10.10.49 -> 10.10.10.251
Ether / IP / TCP 10.10.10.49:55341 > 10.10.10.251:ipp FA
10.10.10.49 -> 10.10.10.251
Ether / IP / TCP 10.10.10.49:55342 > 10.10.10.251:ipp S
10.10.10.49 -> 10.10.10.251
Ether / IP / TCP 10.10.10.251:ipp > 10.10.10.49:55341 A
10.10.10.251 -> 10.10.10.49
Ether / IP / TCP 10.10.10.251:ipp > 10.10.10.49:55342 SA
10.10.10.251 -> 10.10.10.49
Ether / IP / TCP 10.10.10.49:55342 > 10.10.10.251:ipp A
10.10.10.49 -> 10.10.10.251
Ether / IP / TCP 10.10.10.49:55342 > 10.10.10.251:ipp PA / Raw
10.10.10.49 -> 10.10.10.251
Ether / IP / TCP 10.10.10.49:55342 > 10.10.10.251:ipp PA / Raw
10.10.10.49 -> 10.10.10.251
Ether / IP / TCP 10.10.10.251:ipp > 10.10.10.49:55341 FA
10.10.10.251 -> 10.10.10.49
Ether / IP / TCP 10.10.10.49:55341 > 10.10.10.251:ipp A
10.10.10.49 -> 10.10.10.251
Ether / IP / TCP 10.10.10.251:ipp > 10.10.10.49:55342 A
10.10.10.251 -> 10.10.10.49
Ether / IP / TCP 10.10.10.251:ipp > 10.10.10.49:55342 PA / Raw
10.10.10.251 -> 10.10.10.49
Ether / IP / TCP 10.10.10.49:55342 > 10.10.10.251:ipp A
10.10.10.49 -> 10.10.10.251
Ether / IP / TCP 10.10.10.49:55342 > 10.10.10.251:ipp A / Raw
10.10.10.49 -> 10.10.10.251
Ether / IP / TCP 10.10.10.49:55342 > 10.10.10.251:ipp A / Raw
10.10.10.49 -> 10.10.10.251
Ether / IP / TCP 10.10.10.251:ipp > 10.10.10.49:55342 A
10.10.10.251 -> 10.10.10.49
Ether / IP / TCP 10.10.10.49:55342 > 10.10.10.251:ipp PA / Raw
10.10.10.49 -> 10.10.10.251
Ether / IP / TCP 10.10.10.49:55342 > 10.10.10.251:ipp A / Raw
10.10.10.49 -> 10.10.10.251
Ether / IP / TCP 10.10.10.251:ipp > 10.10.10.49:55342 A
10.10.10.251 -> 10.10.10.49
Ether / IP / TCP 10.10.10.49:55342 > 10.10.10.251:ipp PA / Raw
10.10.10.49 -> 10.10.10.251
Ether / IP / TCP 10.10.10.49:55342 > 10.10.10.251:ipp A / Raw
10.10.10.49 -> 10.10.10.251
Ether / IP / TCP 10.10.10.251:ipp > 10.10.10.49:55342 A
10.10.10.251 -> 10.10.10.49
Ether / IP / TCP 10.10.10.49:55342 > 10.10.10.251:ipp A / Raw
10.10.10.49 -> 10.10.10.251
Ether / IP / TCP 10.10.10.49:55342 > 10.10.10.251:ipp A / Raw
10.10.10.49 -> 10.10.10.251
Ether / IP / TCP 10.10.10.251:ipp > 10.10.10.49:55342 A
10.10.10.251 -> 10.10.10.49
Ether / IP / TCP 10.10.10.49:55342 > 10.10.10.251:ipp PA / Raw
10.10.10.49 -> 10.10.10.251
Ether / IP / TCP 10.10.10.49:55342 > 10.10.10.251:ipp A / Raw
10.10.10.49 -> 10.10.10.251
Ether / IP / TCP 10.10.10.251:ipp > 10.10.10.49:55342 A
10.10.10.251 -> 10.10.10.49
Ether / IP / TCP 10.10.10.49:55342 > 10.10.10.251:ipp A / Raw
10.10.10.49 -> 10.10.10.251
Ether / IP / TCP 10.10.10.49:55342 > 10.10.10.251:ipp A / Raw
10.10.10.49 -> 10.10.10.251
Ether / IP / TCP 10.10.10.251:ipp > 10.10.10.49:55342 A
10.10.10.251 -> 10.10.10.49
Ether / IP / TCP 10.10.10.49:55342 > 10.10.10.251:ipp PA / Raw
10.10.10.49 -> 10.10.10.251
Ether / IP / TCP 10.10.10.49:55342 > 10.10.10.251:ipp A / Raw
10.10.10.49 -> 10.10.10.251
Ether / IP / TCP 10.10.10.251:ipp > 10.10.10.49:55342 A
10.10.10.251 -> 10.10.10.49
Ether / IP / TCP 10.10.10.49:55342 > 10.10.10.251:ipp PA / Raw
10.10.10.49 -> 10.10.10.251
Ether / IP / TCP 10.10.10.49:55342 > 10.10.10.251:ipp A / Raw
10.10.10.49 -> 10.10.10.251
Ether / IP / TCP 10.10.10.251:ipp > 10.10.10.49:55342 A
10.10.10.251 -> 10.10.10.49
Ether / IP / TCP 10.10.10.49:55342 > 10.10.10.251:ipp A / Raw
10.10.10.49 -> 10.10.10.251
Ether / IP / TCP 10.10.10.49:55342 > 10.10.10.251:ipp A / Raw
10.10.10.49 -> 10.10.10.251
Ether / IP / TCP 10.10.10.251:ipp > 10.10.10.49:55342 A
10.10.10.251 -> 10.10.10.49
Ether / IP / TCP 10.10.10.49:55342 > 10.10.10.251:ipp PA / Raw
10.10.10.49 -> 10.10.10.251
Ether / IP / TCP 10.10.10.49:55342 > 10.10.10.251:ipp A / Raw
10.10.10.49 -> 10.10.10.251
Ether / IP / TCP 10.10.10.251:ipp > 10.10.10.49:55342 A
10.10.10.251 -> 10.10.10.49
Ether / IP / TCP 10.10.10.49:55342 > 10.10.10.251:ipp A / Raw
10.10.10.49 -> 10.10.10.251
Ether / IP / TCP 10.10.10.49:55342 > 10.10.10.251:ipp A / Raw
10.10.10.49 -> 10.10.10.251
Ether / IP / TCP 10.10.10.251:ipp > 10.10.10.49:55342 A
10.10.10.251 -> 10.10.10.49
Ether / IP / TCP 10.10.10.49:55342 > 10.10.10.251:ipp PA / Raw
10.10.10.49 -> 10.10.10.251
Ether / IP / TCP 10.10.10.49:55342 > 10.10.10.251:ipp A / Raw
10.10.10.49 -> 10.10.10.251
Ether / IP / TCP 10.10.10.251:ipp > 10.10.10.49:55342 A
10.10.10.251 -> 10.10.10.49
Ether / IP / TCP 10.10.10.49:55342 > 10.10.10.251:ipp A / Raw
10.10.10.49 -> 10.10.10.251
Ether / IP / TCP 10.10.10.49:55342 > 10.10.10.251:ipp A / Raw
10.10.10.49 -> 10.10.10.251
Ether / IP / TCP 10.10.10.251:ipp > 10.10.10.49:55342 A
10.10.10.251 -> 10.10.10.49
Ether / IP / TCP 10.10.10.49:55342 > 10.10.10.251:ipp PA / Raw
10.10.10.49 -> 10.10.10.251
Ether / IP / TCP 10.10.10.49:55342 > 10.10.10.251:ipp A / Raw
10.10.10.49 -> 10.10.10.251
Ether / IP / TCP 10.10.10.251:ipp > 10.10.10.49:55342 A
10.10.10.251 -> 10.10.10.49
Ether / IP / TCP 10.10.10.49:55342 > 10.10.10.251:ipp A / Raw
10.10.10.49 -> 10.10.10.251
Ether / IP / TCP 10.10.10.49:55342 > 10.10.10.251:ipp A / Raw
10.10.10.49 -> 10.10.10.251
Ether / IP / TCP 10.10.10.251:ipp > 10.10.10.49:55342 A
10.10.10.251 -> 10.10.10.49
Ether / IP / TCP 10.10.10.49:55342 > 10.10.10.251:ipp PA / Raw
10.10.10.49 -> 10.10.10.251
Ether / IP / TCP 10.10.10.49:55342 > 10.10.10.251:ipp A / Raw
10.10.10.49 -> 10.10.10.251
Ether / IP / TCP 10.10.10.251:ipp > 10.10.10.49:55342 A
10.10.10.251 -> 10.10.10.49
Ether / IP / TCP 10.10.10.49:55342 > 10.10.10.251:ipp A / Raw
10.10.10.49 -> 10.10.10.251
Ether / IP / TCP 10.10.10.49:55342 > 10.10.10.251:ipp A / Raw
10.10.10.49 -> 10.10.10.251
Ether / IP / TCP 10.10.10.251:ipp > 10.10.10.49:55342 A
10.10.10.251 -> 10.10.10.49
Ether / IP / TCP 10.10.10.49:55342 > 10.10.10.251:ipp PA / Raw
10.10.10.49 -> 10.10.10.251
Ether / IP / TCP 10.10.10.49:55342 > 10.10.10.251:ipp A / Raw
10.10.10.49 -> 10.10.10.251
Ether / IP / TCP 10.10.10.251:ipp > 10.10.10.49:55342 A
10.10.10.251 -> 10.10.10.49
Ether / IP / TCP 10.10.10.49:55342 > 10.10.10.251:ipp A / Raw
10.10.10.49 -> 10.10.10.251
Ether / IP / TCP 10.10.10.49:55342 > 10.10.10.251:ipp A / Raw
10.10.10.49 -> 10.10.10.251
Ether / IP / TCP 10.10.10.251:ipp > 10.10.10.49:55342 A
10.10.10.251 -> 10.10.10.49
Ether / IP / TCP 10.10.10.49:55342 > 10.10.10.251:ipp PA / Raw
10.10.10.49 -> 10.10.10.251
Ether / IP / TCP 10.10.10.49:55342 > 10.10.10.251:ipp A / Raw
10.10.10.49 -> 10.10.10.251
Ether / IP / TCP 10.10.10.251:ipp > 10.10.10.49:55342 A
10.10.10.251 -> 10.10.10.49
Ether / IP / TCP 10.10.10.49:55342 > 10.10.10.251:ipp A / Raw
10.10.10.49 -> 10.10.10.251
Ether / IP / TCP 10.10.10.49:55342 > 10.10.10.251:ipp A / Raw
10.10.10.49 -> 10.10.10.251
Ether / IP / TCP 10.10.10.251:ipp > 10.10.10.49:55342 A
10.10.10.251 -> 10.10.10.49
Ether / IP / TCP 10.10.10.49:55342 > 10.10.10.251:ipp PA / Raw
10.10.10.49 -> 10.10.10.251
Ether / IP / TCP 10.10.10.49:55342 > 10.10.10.251:ipp A / Raw
10.10.10.49 -> 10.10.10.251
Ether / IP / TCP 10.10.10.251:ipp > 10.10.10.49:55342 A
10.10.10.251 -> 10.10.10.49
Ether / IP / TCP 10.10.10.49:55342 > 10.10.10.251:ipp PA / Raw
10.10.10.49 -> 10.10.10.251
Ether / IP / TCP 10.10.10.49:55342 > 10.10.10.251:ipp A / Raw
10.10.10.49 -> 10.10.10.251
Ether / IP / TCP 10.10.10.251:ipp > 10.10.10.49:55342 A
10.10.10.251 -> 10.10.10.49
Ether / IP / TCP 10.10.10.49:55342 > 10.10.10.251:ipp A / Raw
10.10.10.49 -> 10.10.10.251
Ether / IP / TCP 10.10.10.49:55342 > 10.10.10.251:ipp A / Raw
10.10.10.49 -> 10.10.10.251
Ether / IP / TCP 10.10.10.251:ipp > 10.10.10.49:55342 A
10.10.10.251 -> 10.10.10.49
Ether / IP / TCP 10.10.10.49:55342 > 10.10.10.251:ipp PA / Raw
10.10.10.49 -> 10.10.10.251
Ether / IP / TCP 10.10.10.49:55342 > 10.10.10.251:ipp A / Raw
10.10.10.49 -> 10.10.10.251
Ether / IP / TCP 10.10.10.251:ipp > 10.10.10.49:55342 A
10.10.10.251 -> 10.10.10.49
Ether / IP / TCP 10.10.10.49:55342 > 10.10.10.251:ipp PA / Raw
10.10.10.49 -> 10.10.10.251
Ether / IP / TCP 10.10.10.49:55342 > 10.10.10.251:ipp A / Raw
10.10.10.49 -> 10.10.10.251
Ether / IP / TCP 10.10.10.251:ipp > 10.10.10.49:55342 A
10.10.10.251 -> 10.10.10.49
Ether / IP / TCP 10.10.10.49:55342 > 10.10.10.251:ipp A / Raw
10.10.10.49 -> 10.10.10.251
Ether / IP / TCP 10.10.10.49:55342 > 10.10.10.251:ipp A / Raw
10.10.10.49 -> 10.10.10.251
Ether / IP / TCP 10.10.10.251:ipp > 10.10.10.49:55342 A
10.10.10.251 -> 10.10.10.49
Ether / IP / TCP 10.10.10.49:55342 > 10.10.10.251:ipp PA / Raw
10.10.10.49 -> 10.10.10.251
Ether / IP / TCP 10.10.10.49:55342 > 10.10.10.251:ipp A / Raw
10.10.10.49 -> 10.10.10.251
Ether / IP / TCP 10.10.10.251:ipp > 10.10.10.49:55342 A
10.10.10.251 -> 10.10.10.49
Ether / IP / TCP 10.10.10.49:55342 > 10.10.10.251:ipp PA / Raw
10.10.10.49 -> 10.10.10.251
Ether / IP / TCP 10.10.10.49:55342 > 10.10.10.251:ipp A / Raw
10.10.10.49 -> 10.10.10.251
Ether / IP / TCP 10.10.10.251:ipp > 10.10.10.49:55342 A
10.10.10.251 -> 10.10.10.49
Ether / IP / TCP 10.10.10.49:55342 > 10.10.10.251:ipp A / Raw
10.10.10.49 -> 10.10.10.251
Ether / IP / TCP 10.10.10.49:55342 > 10.10.10.251:ipp A / Raw
10.10.10.49 -> 10.10.10.251
Ether / IP / TCP 10.10.10.251:ipp > 10.10.10.49:55342 A
10.10.10.251 -> 10.10.10.49
Ether / IP / TCP 10.10.10.49:55342 > 10.10.10.251:ipp PA / Raw
10.10.10.49 -> 10.10.10.251
Ether / IP / TCP 10.10.10.49:55342 > 10.10.10.251:ipp A / Raw
10.10.10.49 -> 10.10.10.251
Ether / IP / TCP 10.10.10.251:ipp > 10.10.10.49:55342 A
10.10.10.251 -> 10.10.10.49
Ether / IP / TCP 10.10.10.49:55342 > 10.10.10.251:ipp PA / Raw
10.10.10.49 -> 10.10.10.251
Ether / IP / TCP 10.10.10.49:55342 > 10.10.10.251:ipp A / Raw
10.10.10.49 -> 10.10.10.251
Ether / IP / TCP 10.10.10.251:ipp > 10.10.10.49:55342 A
10.10.10.251 -> 10.10.10.49
Ether / IP / TCP 10.10.10.49:55342 > 10.10.10.251:ipp A / Raw
10.10.10.49 -> 10.10.10.251
Ether / IP / TCP 10.10.10.49:55342 > 10.10.10.251:ipp A / Raw
10.10.10.49 -> 10.10.10.251
Ether / IP / TCP 10.10.10.251:ipp > 10.10.10.49:55342 A
10.10.10.251 -> 10.10.10.49
Ether / IP / TCP 10.10.10.49:55342 > 10.10.10.251:ipp A / Raw
10.10.10.49 -> 10.10.10.251
Ether / IP / TCP 10.10.10.49:55342 > 10.10.10.251:ipp A / Raw
10.10.10.49 -> 10.10.10.251
Ether / IP / TCP 10.10.10.251:ipp > 10.10.10.49:55342 A
10.10.10.251 -> 10.10.10.49
Ether / IP / TCP 10.10.10.49:55342 > 10.10.10.251:ipp PA / Raw
10.10.10.49 -> 10.10.10.251
Ether / IP / TCP 10.10.10.49:55342 > 10.10.10.251:ipp A / Raw
10.10.10.49 -> 10.10.10.251
Ether / IP / TCP 10.10.10.251:ipp > 10.10.10.49:55342 A
10.10.10.251 -> 10.10.10.49
Ether / IP / TCP 10.10.10.49:55342 > 10.10.10.251:ipp A / Raw
10.10.10.49 -> 10.10.10.251
Ether / IP / TCP 10.10.10.49:55342 > 10.10.10.251:ipp A / Raw
10.10.10.49 -> 10.10.10.251
Ether / IP / TCP 10.10.10.251:ipp > 10.10.10.49:55342 A
10.10.10.251 -> 10.10.10.49
Ether / IP / TCP 10.10.10.49:55342 > 10.10.10.251:ipp PA / Raw
10.10.10.49 -> 10.10.10.251
Ether / IP / TCP 10.10.10.49:55342 > 10.10.10.251:ipp A / Raw
10.10.10.49 -> 10.10.10.251
Ether / IP / TCP 10.10.10.251:ipp > 10.10.10.49:55342 A
10.10.10.251 -> 10.10.10.49
Ether / IP / TCP 10.10.10.49:55342 > 10.10.10.251:ipp PA / Raw
10.10.10.49 -> 10.10.10.251
Ether / IP / TCP 10.10.10.49:55342 > 10.10.10.251:ipp A / Raw
10.10.10.49 -> 10.10.10.251
Ether / IP / TCP 10.10.10.251:ipp > 10.10.10.49:55342 A
10.10.10.251 -> 10.10.10.49
Ether / IP / TCP 10.10.10.49:55342 > 10.10.10.251:ipp A / Raw
10.10.10.49 -> 10.10.10.251
Ether / IP / TCP 10.10.10.49:55342 > 10.10.10.251:ipp A / Raw
10.10.10.49 -> 10.10.10.251
Ether / IP / TCP 10.10.10.251:ipp > 10.10.10.49:55342 A
10.10.10.251 -> 10.10.10.49
Ether / IP / TCP 10.10.10.49:55342 > 10.10.10.251:ipp PA / Raw
10.10.10.49 -> 10.10.10.251
Ether / IP / TCP 10.10.10.49:55342 > 10.10.10.251:ipp A / Raw
10.10.10.49 -> 10.10.10.251
Ether / IP / TCP 10.10.10.251:ipp > 10.10.10.49:55342 A
10.10.10.251 -> 10.10.10.49
Ether / IP / TCP 10.10.10.49:55342 > 10.10.10.251:ipp PA / Raw
10.10.10.49 -> 10.10.10.251
Ether / IP / TCP 10.10.10.49:55342 > 10.10.10.251:ipp A / Raw
10.10.10.49 -> 10.10.10.251
Ether / IP / TCP 10.10.10.251:ipp > 10.10.10.49:55342 A
10.10.10.251 -> 10.10.10.49
Ether / IP / TCP 10.10.10.49:55342 > 10.10.10.251:ipp A / Raw
10.10.10.49 -> 10.10.10.251
Ether / IP / TCP 10.10.10.49:55342 > 10.10.10.251:ipp A / Raw
10.10.10.49 -> 10.10.10.251
Ether / IP / TCP 10.10.10.251:ipp > 10.10.10.49:55342 A
10.10.10.251 -> 10.10.10.49
Ether / IP / TCP 10.10.10.49:55342 > 10.10.10.251:ipp PA / Raw
10.10.10.49 -> 10.10.10.251
Ether / IP / TCP 10.10.10.49:55342 > 10.10.10.251:ipp A / Raw
10.10.10.49 -> 10.10.10.251
Ether / IP / TCP 10.10.10.251:ipp > 10.10.10.49:55342 A
10.10.10.251 -> 10.10.10.49
Ether / IP / TCP 10.10.10.49:55342 > 10.10.10.251:ipp PA / Raw
10.10.10.49 -> 10.10.10.251
Ether / IP / TCP 10.10.10.49:55342 > 10.10.10.251:ipp A / Raw
10.10.10.49 -> 10.10.10.251
Ether / IP / TCP 10.10.10.251:ipp > 10.10.10.49:55342 A
10.10.10.251 -> 10.10.10.49
Ether / IP / TCP 10.10.10.49:55342 > 10.10.10.251:ipp A / Raw
10.10.10.49 -> 10.10.10.251
Ether / IP / TCP 10.10.10.49:55342 > 10.10.10.251:ipp A / Raw
10.10.10.49 -> 10.10.10.251
Ether / IP / TCP 10.10.10.251:ipp > 10.10.10.49:55342 A
10.10.10.251 -> 10.10.10.49
Ether / IP / TCP 10.10.10.49:55342 > 10.10.10.251:ipp PA / Raw
10.10.10.49 -> 10.10.10.251
Ether / IP / TCP 10.10.10.49:55342 > 10.10.10.251:ipp A / Raw
10.10.10.49 -> 10.10.10.251
Ether / IP / TCP 10.10.10.251:ipp > 10.10.10.49:55342 A
10.10.10.251 -> 10.10.10.49
Ether / IP / TCP 10.10.10.49:55342 > 10.10.10.251:ipp PA / Raw
10.10.10.49 -> 10.10.10.251
Ether / IP / TCP 10.10.10.49:55342 > 10.10.10.251:ipp A / Raw
10.10.10.49 -> 10.10.10.251
Ether / IP / TCP 10.10.10.251:ipp > 10.10.10.49:55342 A
10.10.10.251 -> 10.10.10.49
Ether / IP / TCP 10.10.10.49:55342 > 10.10.10.251:ipp A / Raw
10.10.10.49 -> 10.10.10.251
Ether / IP / TCP 10.10.10.49:55342 > 10.10.10.251:ipp A / Raw
10.10.10.49 -> 10.10.10.251
Ether / IP / TCP 10.10.10.251:ipp > 10.10.10.49:55342 A
10.10.10.251 -> 10.10.10.49
Ether / IP / TCP 10.10.10.49:55342 > 10.10.10.251:ipp PA / Raw
10.10.10.49 -> 10.10.10.251
Ether / IP / TCP 10.10.10.49:55342 > 10.10.10.251:ipp A / Raw
10.10.10.49 -> 10.10.10.251
Ether / IP / TCP 10.10.10.251:ipp > 10.10.10.49:55342 A
10.10.10.251 -> 10.10.10.49
Ether / IP / TCP 10.10.10.49:55342 > 10.10.10.251:ipp PA / Raw
10.10.10.49 -> 10.10.10.251
Ether / IP / TCP 10.10.10.49:55342 > 10.10.10.251:ipp A / Raw
10.10.10.49 -> 10.10.10.251
Ether / IP / TCP 10.10.10.251:ipp > 10.10.10.49:55342 A
10.10.10.251 -> 10.10.10.49
Ether / IP / TCP 10.10.10.49:55342 > 10.10.10.251:ipp A / Raw
10.10.10.49 -> 10.10.10.251
Ether / IP / TCP 10.10.10.49:55342 > 10.10.10.251:ipp A / Raw
10.10.10.49 -> 10.10.10.251
Ether / IP / TCP 10.10.10.251:ipp > 10.10.10.49:55342 A
10.10.10.251 -> 10.10.10.49
Ether / IP / TCP 10.10.10.49:55342 > 10.10.10.251:ipp PA / Raw
10.10.10.49 -> 10.10.10.251
Ether / IP / TCP 10.10.10.49:55342 > 10.10.10.251:ipp A / Raw
10.10.10.49 -> 10.10.10.251
Ether / IP / TCP 10.10.10.251:ipp > 10.10.10.49:55342 A
10.10.10.251 -> 10.10.10.49
Ether / IP / TCP 10.10.10.49:55342 > 10.10.10.251:ipp PA / Raw
10.10.10.49 -> 10.10.10.251
Ether / IP / TCP 10.10.10.49:55342 > 10.10.10.251:ipp A / Raw
10.10.10.49 -> 10.10.10.251
Ether / IP / TCP 10.10.10.251:ipp > 10.10.10.49:55342 A
10.10.10.251 -> 10.10.10.49
Ether / IP / TCP 10.10.10.49:55342 > 10.10.10.251:ipp A / Raw
10.10.10.49 -> 10.10.10.251
Ether / IP / TCP 10.10.10.49:55342 > 10.10.10.251:ipp A / Raw
10.10.10.49 -> 10.10.10.251
Ether / IP / TCP 10.10.10.251:ipp > 10.10.10.49:55342 A
10.10.10.251 -> 10.10.10.49
Ether / IP / TCP 10.10.10.49:55342 > 10.10.10.251:ipp PA / Raw
10.10.10.49 -> 10.10.10.251
Ether / IP / TCP 10.10.10.49:55342 > 10.10.10.251:ipp A / Raw
10.10.10.49 -> 10.10.10.251
Ether / IP / TCP 10.10.10.251:ipp > 10.10.10.49:55342 A
10.10.10.251 -> 10.10.10.49
Ether / IP / TCP 10.10.10.49:55342 > 10.10.10.251:ipp PA / Raw
10.10.10.49 -> 10.10.10.251
Ether / IP / TCP 10.10.10.49:55342 > 10.10.10.251:ipp A / Raw
10.10.10.49 -> 10.10.10.251
Ether / IP / TCP 10.10.10.251:ipp > 10.10.10.49:55342 A
10.10.10.251 -> 10.10.10.49
Ether / IP / TCP 10.10.10.49:55342 > 10.10.10.251:ipp A / Raw
10.10.10.49 -> 10.10.10.251
Ether / IP / TCP 10.10.10.49:55342 > 10.10.10.251:ipp A / Raw
10.10.10.49 -> 10.10.10.251
Ether / IP / TCP 10.10.10.251:ipp > 10.10.10.49:55342 A
10.10.10.251 -> 10.10.10.49
Ether / IP / TCP 10.10.10.49:55342 > 10.10.10.251:ipp PA / Raw
10.10.10.49 -> 10.10.10.251
Ether / IP / TCP 10.10.10.49:55342 > 10.10.10.251:ipp A / Raw
10.10.10.49 -> 10.10.10.251
Ether / IP / TCP 10.10.10.251:ipp > 10.10.10.49:55342 A
10.10.10.251 -> 10.10.10.49
Ether / IP / TCP 10.10.10.49:55342 > 10.10.10.251:ipp PA / Raw
10.10.10.49 -> 10.10.10.251
Ether / IP / TCP 10.10.10.49:55342 > 10.10.10.251:ipp A / Raw
10.10.10.49 -> 10.10.10.251
Ether / IP / TCP 10.10.10.251:ipp > 10.10.10.49:55342 A
10.10.10.251 -> 10.10.10.49
Ether / IP / TCP 10.10.10.49:55342 > 10.10.10.251:ipp A / Raw
10.10.10.49 -> 10.10.10.251
Ether / IP / TCP 10.10.10.49:55342 > 10.10.10.251:ipp PA / Raw
10.10.10.49 -> 10.10.10.251
Ether / IP / TCP 10.10.10.251:ipp > 10.10.10.49:55342 A
10.10.10.251 -> 10.10.10.49
Ether / IP / TCP 10.10.10.49:55342 > 10.10.10.251:ipp PA / Raw
10.10.10.49 -> 10.10.10.251
Ether / IP / TCP 10.10.10.251:ipp > 10.10.10.49:55342 A
10.10.10.251 -> 10.10.10.49
Ether / IP / TCP 10.10.10.49:55342 > 10.10.10.251:ipp A / Raw
10.10.10.49 -> 10.10.10.251
Ether / IP / TCP 10.10.10.251:ipp > 10.10.10.49:55342 A
10.10.10.251 -> 10.10.10.49
Ether / IP / TCP 10.10.10.49:55342 > 10.10.10.251:ipp PA / Raw
10.10.10.49 -> 10.10.10.251
Ether / IP / TCP 10.10.10.49:55342 > 10.10.10.251:ipp PA / Raw
10.10.10.49 -> 10.10.10.251
Ether / IP / TCP 10.10.10.251:ipp > 10.10.10.49:55342 A
10.10.10.251 -> 10.10.10.49
Ether / IP / TCP 10.10.10.49:55342 > 10.10.10.251:ipp A / Raw
10.10.10.49 -> 10.10.10.251
Ether / IP / TCP 10.10.10.251:ipp > 10.10.10.49:55342 A
10.10.10.251 -> 10.10.10.49
Ether / IP / TCP 10.10.10.49:55342 > 10.10.10.251:ipp PA / Raw
10.10.10.49 -> 10.10.10.251
Ether / IP / TCP 10.10.10.49:55342 > 10.10.10.251:ipp PA / Raw
10.10.10.49 -> 10.10.10.251
Ether / IP / TCP 10.10.10.251:ipp > 10.10.10.49:55342 A
10.10.10.251 -> 10.10.10.49
Ether / IP / TCP 10.10.10.49:55342 > 10.10.10.251:ipp A / Raw
10.10.10.49 -> 10.10.10.251
Ether / IP / TCP 10.10.10.251:ipp > 10.10.10.49:55342 A
10.10.10.251 -> 10.10.10.49
Ether / IP / TCP 10.10.10.49:55342 > 10.10.10.251:ipp PA / Raw
10.10.10.49 -> 10.10.10.251
Ether / IP / TCP 10.10.10.251:ipp > 10.10.10.49:55342 A
10.10.10.251 -> 10.10.10.49
Ether / IP / TCP 10.10.10.49:55342 > 10.10.10.251:ipp A / Raw
10.10.10.49 -> 10.10.10.251
Ether / IP / TCP 10.10.10.251:ipp > 10.10.10.49:55342 A
10.10.10.251 -> 10.10.10.49
Ether / IP / TCP 10.10.10.49:55342 > 10.10.10.251:ipp PA / Raw
10.10.10.49 -> 10.10.10.251
Ether / IP / TCP 10.10.10.251:ipp > 10.10.10.49:55342 A
10.10.10.251 -> 10.10.10.49
Ether / IP / TCP 10.10.10.49:55342 > 10.10.10.251:ipp A / Raw
10.10.10.49 -> 10.10.10.251
Ether / IP / TCP 10.10.10.251:ipp > 10.10.10.49:55342 A
10.10.10.251 -> 10.10.10.49
Ether / IP / TCP 10.10.10.49:55342 > 10.10.10.251:ipp PA / Raw
10.10.10.49 -> 10.10.10.251
Ether / IP / TCP 10.10.10.49:55342 > 10.10.10.251:ipp PA / Raw
10.10.10.49 -> 10.10.10.251
Ether / IP / TCP 10.10.10.251:ipp > 10.10.10.49:55342 A
10.10.10.251 -> 10.10.10.49
Ether / IP / TCP 10.10.10.251:ipp > 10.10.10.49:55342 A
10.10.10.251 -> 10.10.10.49
Ether / IP / TCP 10.10.10.49:55342 > 10.10.10.251:ipp A / Raw
10.10.10.49 -> 10.10.10.251
Ether / IP / TCP 10.10.10.49:55342 > 10.10.10.251:ipp PA / Raw
10.10.10.49 -> 10.10.10.251
Ether / IP / TCP 10.10.10.251:ipp > 10.10.10.49:55342 A
10.10.10.251 -> 10.10.10.49
Ether / IP / TCP 10.10.10.49:55342 > 10.10.10.251:ipp PA / Raw
10.10.10.49 -> 10.10.10.251
Ether / IP / TCP 10.10.10.251:ipp > 10.10.10.49:55342 A
10.10.10.251 -> 10.10.10.49
Ether / IP / TCP 10.10.10.49:55342 > 10.10.10.251:ipp A / Raw
10.10.10.49 -> 10.10.10.251
Ether / IP / TCP 10.10.10.251:ipp > 10.10.10.49:55342 A
10.10.10.251 -> 10.10.10.49
Ether / IP / TCP 10.10.10.49:55342 > 10.10.10.251:ipp PA / Raw
10.10.10.49 -> 10.10.10.251
Ether / IP / TCP 10.10.10.49:55342 > 10.10.10.251:ipp A / Raw
10.10.10.49 -> 10.10.10.251
Ether / IP / TCP 10.10.10.251:ipp > 10.10.10.49:55342 A
10.10.10.251 -> 10.10.10.49
Ether / IP / TCP 10.10.10.49:55342 > 10.10.10.251:ipp PA / Raw
10.10.10.49 -> 10.10.10.251
Ether / IP / TCP 10.10.10.251:ipp > 10.10.10.49:55342 A
10.10.10.251 -> 10.10.10.49
Ether / IP / TCP 10.10.10.251:ipp > 10.10.10.49:55342 PA / Raw
10.10.10.251 -> 10.10.10.49
Ether / IP / TCP 10.10.10.49:55342 > 10.10.10.251:ipp A
10.10.10.49 -> 10.10.10.251
Ether / IP / TCP 10.10.10.251:ipp > 10.10.10.49:55342 PA / Raw
10.10.10.251 -> 10.10.10.49
Ether / IP / TCP 10.10.10.49:55342 > 10.10.10.251:ipp A
10.10.10.49 -> 10.10.10.251
Ether / IP / TCP 10.10.10.49:55342 > 10.10.10.251:ipp FA
10.10.10.49 -> 10.10.10.251
Ether / IP / TCP 10.10.10.49:55343 > 10.10.10.251:ipp S
10.10.10.49 -> 10.10.10.251
Ether / IP / TCP 10.10.10.251:ipp > 10.10.10.49:55342 A
10.10.10.251 -> 10.10.10.49
Ether / IP / TCP 10.10.10.251:ipp > 10.10.10.49:55343 SA
10.10.10.251 -> 10.10.10.49
Ether / IP / TCP 10.10.10.49:55343 > 10.10.10.251:ipp A
10.10.10.49 -> 10.10.10.251
Ether / IP / TCP 10.10.10.49:55343 > 10.10.10.251:ipp PA / Raw
10.10.10.49 -> 10.10.10.251
Ether / IP / TCP 10.10.10.49:55343 > 10.10.10.251:ipp PA / Raw
10.10.10.49 -> 10.10.10.251
Ether / IP / TCP 10.10.10.251:ipp > 10.10.10.49:55342 FA
10.10.10.251 -> 10.10.10.49
Ether / IP / TCP 10.10.10.49:55342 > 10.10.10.251:ipp A
10.10.10.49 -> 10.10.10.251
Ether / IP / TCP 10.10.10.251:ipp > 10.10.10.49:55343 A
10.10.10.251 -> 10.10.10.49
Ether / IP / TCP 10.10.10.251:ipp > 10.10.10.49:55343 PA / Raw
10.10.10.251 -> 10.10.10.49
Ether / IP / TCP 10.10.10.49:55343 > 10.10.10.251:ipp A
10.10.10.49 -> 10.10.10.251
Ether / IP / TCP 10.10.10.251:ipp > 10.10.10.49:55343 PA / Raw
10.10.10.251 -> 10.10.10.49
Ether / IP / TCP 10.10.10.49:55343 > 10.10.10.251:ipp A
10.10.10.49 -> 10.10.10.251
Ether / IP / TCP 10.10.10.251:ipp > 10.10.10.49:55343 PA / Raw
10.10.10.251 -> 10.10.10.49
Ether / IP / TCP 10.10.10.49:55343 > 10.10.10.251:ipp A
10.10.10.49 -> 10.10.10.251
Ether / IP / TCP 10.10.10.251:ipp > 10.10.10.49:55343 PA / Raw
10.10.10.251 -> 10.10.10.49
Ether / IP / TCP 10.10.10.49:55343 > 10.10.10.251:ipp A
10.10.10.49 -> 10.10.10.251
Ether / IP / TCP 10.10.10.49:55343 > 10.10.10.251:ipp PA / Raw
10.10.10.49 -> 10.10.10.251
Ether / IP / TCP 10.10.10.49:55343 > 10.10.10.251:ipp PA / Raw
10.10.10.49 -> 10.10.10.251
Ether / IP / TCP 10.10.10.251:ipp > 10.10.10.49:55343 A
10.10.10.251 -> 10.10.10.49
Ether / IP / TCP 10.10.10.251:ipp > 10.10.10.49:55343 PA / Raw
10.10.10.251 -> 10.10.10.49
Ether / IP / TCP 10.10.10.49:55343 > 10.10.10.251:ipp A
10.10.10.49 -> 10.10.10.251
Ether / IP / TCP 10.10.10.251:ipp > 10.10.10.49:55343 PA / Raw
10.10.10.251 -> 10.10.10.49
Ether / IP / TCP 10.10.10.49:55343 > 10.10.10.251:ipp A
10.10.10.49 -> 10.10.10.251
Ether / IP / TCP 10.10.10.49:55343 > 10.10.10.251:ipp FA
10.10.10.49 -> 10.10.10.251
Ether / IP / TCP 10.10.10.251:ipp > 10.10.10.49:55343 A
10.10.10.251 -> 10.10.10.49
Ether / IP / TCP 10.10.10.251:ipp > 10.10.10.49:55343 FA
10.10.10.251 -> 10.10.10.49
Ether / IP / TCP 10.10.10.49:55343 > 10.10.10.251:ipp A
10.10.10.49 -> 10.10.10.251
